{
  "$schema": "../../test-recipe-schema.json",
  "testApplicationName": "standard-frontend-react",
  "buildCommand": "pnpm install && npx playwright install && pnpm build",
  "tests": [
    {
      "testName": "Playwright tests",
      "testCommand": "yarn test"
    }
  ],
  "canaryVersions": [
    {
      "dependencyOverrides": {
        "react": "latest",
        "react-dom": "latest"
      }
    }
  ]
}
