{
  "$schema": "../../test-recipe-schema.json",
  "testApplicationName": "nextjs-13-app-dir",
  "buildCommand": "yarn install --mutex network && npx playwright install && yarn build",
  "buildAssertionCommand": "yarn ts-node --script-mode assert-build.ts",
  "tests": [
    {
      "testName": "Prod Mode",
      "testCommand": "yarn test:prod"
    },
    {
      "testName": "Dev Mode",
      "testCommand": "yarn test:dev"
    }
  ],
  "canaryVersions": [
    {
      "dependencyOverrides": {
        "next": "latest"
      }
    },
    {
      "dependencyOverrides": {
        "next": "canary"
      }
    }
  ]
}
